<?xml version="1.0" encoding="ISO-8859-1" ?>

<!--
    Document   : RaceTemplate.xml
    Created on : 11. januar 2011, 11:42
    Author     : Glenn Rune Strandbråten
    Description:
        This document contains data associated with a Warhammer Race, its units
        and the units attributes. These data are used by the
        WarhammerArmyBuilder software to populate the armies and aquire the
        neccessary information.
-->

<Race xmlns="http://www.w3schools.com"
xmlns:xsi="http://www.w3.org/2001/XMLSchema-instance"
xsi:schemaLocation="http://www.w3schools.com Warhammer.xsd">
    <RaceName></RaceName>
    <Unit>
        <UnitName></UnitName>
        <Movement></Movement>
        <WeaponSkill></WeaponSkill>
        <BallisticSkill></BallisticSkill>
        <Strength></Strength>
        <Toughness></Toughness>
        <Wounds></Wounds>
        <Initiative></Initiative>
        <Attack></Attack>
        <Leadership></Leadership>
        <Type></Type>
    </Unit>
    <Unit>
        <UnitName></UnitName>
        <Movement></Movement>
        <WeaponSkill></WeaponSkill>
        <BallisticSkill></BallisticSkill>
        <Strength></Strength>
        <Toughness></Toughness>
        <Wounds></Wounds>
        <Initiative></Initiative>
        <Attack></Attack>
        <Leadership></Leadership>
        <Type></Type>
        <Mount>
            <MountName></MountName>
            <Movement></Movement>
            <WeaponSkill></WeaponSkill>
            <BallisticSkill></BallisticSkill>
            <Strength></Strength>
            <Toughness></Toughness>
            <Wounds></Wounds>
            <Initiative></Initiative>
            <Attack></Attack>
            <Leadership></Leadership>
            <Type></Type>
        </Mount>
    </Unit>
    <Unit>
        <UnitName></UnitName>
        <Movement></Movement>
        <WeaponSkill></WeaponSkill>
        <BallisticSkill></BallisticSkill>
        <Strength></Strength>
        <Toughness></Toughness>
        <Wounds></Wounds>
        <Initiative></Initiative>
        <Attack></Attack>
        <Leadership></Leadership>
        <Type></Type>
        <Crew>
            <CrewName></CrewName>
            <Movement></Movement>
            <WeaponSkill></WeaponSkill>
            <BallisticSkill></BallisticSkill>
            <Strength></Strength>
            <Toughness></Toughness>
            <Wounds></Wounds>
            <Initiative></Initiative>
            <Attack></Attack>
            <Leadership></Leadership>
            <Type></Type>
        </Crew>
    </Unit>
</Race>
